{
  "mock_id": "page-analysis-mcp",
  "server_name": "page-analysis-mcp",
  "protocol": "mcp_stdio",
  "description": "Synthetic MCP server for page candidate retrieval and optional page/customer analysis tools.",
  "source": {
    "prefill_from_catalog": false,
    "catalog_entry_name": null,
    "catalog_file": null
  },
  "tools": [
    {
      "name": "search_page_candidates",
      "title": "Page candidate RAG retrieval",
      "description": "Search synthetic page candidates from user query, scenario purpose, business domain, and customer behavior classification.",
      "inputSchema": {
        "type": "object",
        "additionalProperties": false,
        "required": [
          "query",
          "scenario_design_purpose",
          "scenario_target_business_domain",
          "customer_behavior_classification"
        ],
        "properties": {
          "query": { "type": "string" },
          "scenario_design_purpose": { "type": "string" },
          "scenario_target_business_domain": { "type": "string" },
          "customer_behavior_classification": { "type": "object" },
          "top_k": { "type": "integer" }
        }
      },
      "outputSchema": {
        "type": "object",
        "additionalProperties": false,
        "required": [
          "synthetic",
          "source",
          "page_candidates",
          "retrieval_metadata"
        ],
        "properties": {
          "synthetic": { "type": "boolean" },
          "source": { "type": "string" },
          "page_candidates": {
            "type": "array",
            "items": { "type": "object" }
          },
          "retrieval_metadata": { "type": "object" }
        }
      },
      "successResponse": {
        "synthetic": true,
        "source": "agent-factory-mock-lab",
        "page_candidates": [
          {
            "page_id": "svc-savings-auto-transfer-setup",
            "service_id": "savings",
            "page_name": "적금 자동이체 설정",
            "behavior_path": {
              "large": "가입/전환",
              "medium": "자동이체",
              "small": "설정 이탈"
            },
            "score": 0.94,
            "evidence": [
              "synthetic-rag-page-catalog:autotransfer",
              "behavior-taxonomy:auto-transfer-dropoff"
            ]
          },
          {
            "page_id": "svc-savings-product-detail",
            "service_id": "savings",
            "page_name": "적금 상품 상세",
            "behavior_path": {
              "large": "탐색/비교",
              "medium": "상품 이해",
              "small": "조건 확인"
            },
            "score": 0.78,
            "evidence": [
              "synthetic-rag-page-catalog:savings-detail"
            ]
          }
        ],
        "retrieval_metadata": {
          "query_id": "rag-page-demo-001",
          "corpus": "synthetic-page-catalog-v1",
          "top_k": 2,
          "effective_date": "2026-06-08"
        }
      },
      "errorScenarios": [],
      "latencyMs": 15,
      "riskSignals": [
        "financial_data",
        "audit_required"
      ],
      "auditRequired": true
    },
    {
      "name": "analyze_user_flow",
      "title": "User-flow page analysis",
      "description": "Analyze synthetic user-flow bottlenecks for a selected page id.",
      "inputSchema": {
        "type": "object",
        "additionalProperties": false,
        "required": [
          "scenario_design_purpose",
          "scenario_target",
          "business_domain",
          "page_id"
        ],
        "properties": {
          "scenario_design_purpose": { "type": "string" },
          "scenario_target": { "type": "string" },
          "business_domain": { "type": "string" },
          "page_id": { "type": "string" },
          "additional_required_information": { "type": "string" }
        }
      },
      "outputSchema": {
        "type": "object",
        "additionalProperties": false,
        "required": [
          "synthetic",
          "source",
          "analysis_result",
          "recommended_page_id"
        ],
        "properties": {
          "synthetic": { "type": "boolean" },
          "source": { "type": "string" },
          "analysis_result": { "type": "object" },
          "recommended_page_id": { "type": "string" }
        }
      },
      "successResponse": {
        "synthetic": true,
        "source": "agent-factory-mock-lab",
        "analysis_result": {
          "method": "user_flow_analysis",
          "page_id": "svc-savings-auto-transfer-setup",
          "summary": "자동이체 금액 입력 이후 인증 진입 전 단계에서 synthetic 이탈이 높습니다.",
          "findings": [
            {
              "step": "amount_input",
              "signal": "hesitation",
              "synthetic_dropoff_rate": 0.31
            },
            {
              "step": "auth_entry",
              "signal": "retry",
              "synthetic_dropoff_rate": 0.18
            }
          ],
          "recommended_action": "인증 전 예상 출금일/금액 확인 microcopy를 추가한 시나리오를 workflow2에 전달합니다."
        },
        "recommended_page_id": "svc-savings-auto-transfer-setup"
      },
      "errorScenarios": [],
      "latencyMs": 10,
      "riskSignals": [
        "financial_data",
        "audit_required"
      ],
      "auditRequired": true
    },
    {
      "name": "recommend_behavior_scenarios",
      "title": "Behavior scenario recommendation",
      "description": "Recommend synthetic scenarios from behavior classification and selected page id.",
      "inputSchema": {
        "type": "object",
        "additionalProperties": false,
        "required": [
          "scenario_design_purpose",
          "scenario_target",
          "business_domain",
          "page_id"
        ],
        "properties": {
          "scenario_design_purpose": { "type": "string" },
          "scenario_target": { "type": "string" },
          "business_domain": { "type": "string" },
          "page_id": { "type": "string" },
          "additional_required_information": { "type": "string" }
        }
      },
      "outputSchema": {
        "type": "object",
        "additionalProperties": false,
        "required": [
          "synthetic",
          "source",
          "analysis_result",
          "scenario_recommendations",
          "recommended_page_id"
        ],
        "properties": {
          "synthetic": { "type": "boolean" },
          "source": { "type": "string" },
          "analysis_result": { "type": "object" },
          "scenario_recommendations": {
            "type": "array",
            "items": { "type": "object" }
          },
          "recommended_page_id": { "type": "string" }
        }
      },
      "successResponse": {
        "synthetic": true,
        "source": "agent-factory-mock-lab",
        "analysis_result": {
          "method": "behavior_scenario_recommendation",
          "behavior_path": {
            "large": "가입/전환",
            "medium": "자동이체",
            "small": "설정 이탈"
          },
          "summary": "자동이체 설정 이탈 사용자를 복귀시키는 synthetic scenario 후보를 추천합니다."
        },
        "scenario_recommendations": [
          {
            "scenario_id": "auto_transfer_setup_recovery",
            "title": "자동이체 설정 복귀 유도",
            "trigger": "amount_input_abandonment",
            "expected_page_id": "svc-savings-auto-transfer-setup"
          }
        ],
        "recommended_page_id": "svc-savings-auto-transfer-setup"
      },
      "errorScenarios": [],
      "latencyMs": 10,
      "riskSignals": [
        "customer_impact",
        "audit_required"
      ],
      "auditRequired": true
    },
    {
      "name": "execute_page_customer_sql",
      "title": "Readonly page/customer SQL analysis",
      "description": "Analyze synthetic page/customer data from reviewed SQL text produced by a T2S solution.",
      "inputSchema": {
        "type": "object",
        "additionalProperties": false,
        "required": [
          "sql_text"
        ],
        "properties": {
          "sql_text": { "type": "string" }
        }
      },
      "outputSchema": {
        "type": "object",
        "additionalProperties": false,
        "required": [
          "synthetic",
          "source",
          "analysis_result",
          "recommended_page_id",
          "query_summary"
        ],
        "properties": {
          "synthetic": { "type": "boolean" },
          "source": { "type": "string" },
          "analysis_result": { "type": "object" },
          "recommended_page_id": { "type": "string" },
          "query_summary": { "type": "object" }
        }
      },
      "successResponse": {
        "synthetic": true,
        "source": "agent-factory-mock-lab",
        "analysis_result": {
          "method": "text_to_sql_analysis",
          "summary": "synthetic SQL aggregation에서 자동이체 설정 페이지의 재방문 대비 완료율이 낮게 나타납니다.",
          "metrics": [
            {
              "name": "synthetic_visits",
              "value": 1280
            },
            {
              "name": "synthetic_completion_rate",
              "value": 0.42
            }
          ]
        },
        "recommended_page_id": "svc-savings-auto-transfer-setup",
        "query_summary": {
          "readonly": true,
          "tables": [
            "synthetic_page_events"
          ],
          "row_count": 3,
          "sql_hash": "synthetic-sql-hash-001"
        }
      },
      "errorScenarios": [],
      "latencyMs": 10,
      "riskSignals": [
        "financial_data",
        "customer_impact",
        "audit_required"
      ],
      "auditRequired": true
    }
  ],
  "guardrails": {
    "synthetic_only": true,
    "no_private_data": true,
    "no_private_endpoint": true,
    "no_credentials": true,
    "no_production_business_logic": true
  }
}
